{
  "schema_version": "1.0.0",
  "id": "taxonomy.ax-capability-map",
  "version": "0.1.0",
  "title": "AX 역량 분류 레지스트리",
  "status": "provisional",
  "updated_at": "2026-07-27",
  "nodes": [
    {
      "id": "ax-strategy-value",
      "node_type": "domain",
      "status": "research_lens",
      "title_ko": "AX 전략·가치·업무재설계",
      "title_en": "AX strategy, value and work redesign",
      "definition": "AX 기회를 사업 문제와 가치가설로 정의하고 업무·의사결정·포트폴리오·로드맵과 성과측정을 설계하는 조사 렌즈입니다.",
      "includes": [
        "기회·가치 프레이밍, 업무 재설계, 해법 선택, 포트폴리오, 로드맵과 성과측정"
      ],
      "excludes": [
        "상세 기술 구현, 전문 투자심사, 조직 전체 변화관리"
      ],
      "parent_ids": [],
      "aliases": [
        "AX strategy and value"
      ],
      "related_ids": [
        "organization-adoption",
        "data-analytics-ml",
        "integration-automation"
      ],
      "external_mappings": [
        {
          "framework_id": "sfia-9",
          "mapping_type": "partial_overlap",
          "target": "Digital Transformation skills view and business change skills",
          "rationale": "전략·변화·디지털 전환 역량의 누락 점검에는 유용하지만 AX 가치실현 전체와 동일하지 않습니다.",
          "status": "proposed"
        }
      ],
      "provenance": {
        "basis": "user_governance",
        "source_refs": [
          "docs/governance/learning-governance.md",
          "docs/research/phase2-capability-survey-runbook.md",
          "research/capability-survey/checkpoints/wave-01.md"
        ],
        "rationale": "전사 AX가 기술스택 목록으로 축소되지 않는지 검증하기 위한 첫 시험 조사 렌즈입니다."
      },
      "lifecycle": {
        "created_at": "2026-07-26",
        "last_reviewed_at": "2026-07-27",
        "review_due_at": "2026-10-27",
        "superseded_by": null
      }
    },
    {
      "id": "ai-literacy-trust",
      "node_type": "domain",
      "status": "research_lens",
      "title_ko": "AI 리터러시·검증·신뢰",
      "title_en": "AI literacy, verification and trust",
      "definition": "AI의 용도와 한계, 결과 검증, 책임 있는 사용과 인간 판단을 다루는 조사 렌즈입니다.",
      "includes": [
        "AI 리터러시, 근거 검증, 책임 있는 사용, 인간 판단과 결과 신뢰"
      ],
      "excludes": [
        "개별 AI 시스템의 상세 구현과 모델 연구"
      ],
      "parent_ids": [],
      "aliases": [
        "AI literacy and trust"
      ],
      "related_ids": [
        "ai-systems-agents",
        "security-legal-governance",
        "human-ai-experience"
      ],
      "external_mappings": [
        {
          "framework_id": "digcomp-2.2",
          "mapping_type": "boundary_reference",
          "target": "Information and data literacy; safety; problem solving; AI-related examples",
          "rationale": "시민·근로자의 비판적이고 책임 있는 디지털 사용 기준을 제공하지만 전문 AX 수행역량 전체를 대체하지 않습니다.",
          "status": "proposed"
        }
      ],
      "provenance": {
        "basis": "user_governance",
        "source_refs": [
          "docs/governance/learning-governance.md",
          "docs/research/phase2-capability-survey-runbook.md"
        ],
        "rationale": "모든 역할에 공통인 AI 이해와 결과 검증을 특정 개발 직무에서 분리하기 위한 렌즈입니다."
      },
      "lifecycle": {
        "created_at": "2026-07-26",
        "last_reviewed_at": "2026-07-27",
        "review_due_at": "2026-10-27",
        "superseded_by": null
      }
    },
    {
      "id": "ai-systems-agents",
      "node_type": "domain",
      "status": "research_lens",
      "title_ko": "AI 시스템·에이전트",
      "title_en": "AI systems and agents",
      "definition": "LLM, 검색·RAG, 평가, 컨텍스트·도구·메모리와 에이전트 시스템을 다루는 조사 렌즈입니다.",
      "includes": [
        "LLM 응용, 검색·RAG, 에이전트, 평가, 컨텍스트·도구·메모리"
      ],
      "excludes": [
        "일반 소프트웨어 구현 전체와 기초 ML 연구 전체"
      ],
      "parent_ids": [],
      "aliases": [
        "LLM and agent systems"
      ],
      "related_ids": [
        "software-product-engineering",
        "data-analytics-ml",
        "integration-automation",
        "platform-quality-operations"
      ],
      "external_mappings": [
        {
          "framework_id": "sfia-9",
          "mapping_type": "boundary_reference",
          "target": "Applied computing, data science and software engineering skills",
          "rationale": "전문 디지털 역량과 책임 수준을 비교하는 기준이며 최신 에이전트 패턴의 직접 taxonomy로 사용하지 않습니다.",
          "status": "proposed"
        }
      ],
      "provenance": {
        "basis": "user_governance",
        "source_refs": [
          "docs/governance/learning-governance.md",
          "docs/research/phase2-capability-survey-runbook.md",
          "docs/research/trend-signal-governance.md"
        ],
        "rationale": "빠르게 변하는 AI 시스템 구현과 신흥 패턴을 일반 리터러시 및 소프트웨어 코어와 구분하여 조사하기 위한 렌즈입니다."
      },
      "lifecycle": {
        "created_at": "2026-07-26",
        "last_reviewed_at": "2026-07-27",
        "review_due_at": "2026-10-27",
        "superseded_by": null
      }
    },
    {
      "id": "software-product-engineering",
      "node_type": "domain",
      "status": "research_lens",
      "title_ko": "소프트웨어·제품 엔지니어링",
      "title_en": "Software and product engineering",
      "definition": "프론트엔드, 백엔드, API, DB, 테스트, 설계와 바이브 코딩의 공학 실천을 조사하는 잠정 렌즈입니다.",
      "includes": [
        "프론트엔드, 백엔드, API, 애플리케이션 DB, 테스트, 아키텍처와 바이브 코딩"
      ],
      "excludes": [
        "데이터 플랫폼 전반, 조직변화, 순수 UI·UX 연구"
      ],
      "parent_ids": [],
      "aliases": [
        "software engineering",
        "product engineering"
      ],
      "related_ids": [
        "human-ai-experience",
        "platform-quality-operations",
        "security-legal-governance",
        "integration-automation"
      ],
      "external_mappings": [
        {
          "framework_id": "sfia-9",
          "mapping_type": "coverage_reference",
          "target": "Software engineering, digital product development, user-centred design and DevOps skills",
          "rationale": "직무명보다 전문 기술과 책임 수준을 비교하는 외부 기준으로 사용합니다.",
          "status": "proposed"
        },
        {
          "framework_id": "swebok-4.0a",
          "mapping_type": "coverage_reference",
          "target": "SWEBOK 18 knowledge areas including architecture, operations and software security",
          "rationale": "소프트웨어 공학의 안정된 지식영역과 경계를 점검하되 제품·AX 업무 전부로 일반화하지 않습니다.",
          "status": "proposed"
        }
      ],
      "provenance": {
        "basis": "user_governance",
        "source_refs": [
          "docs/governance/learning-governance.md",
          "docs/research/phase2-capability-survey-runbook.md"
        ],
        "rationale": "프론트엔드·백엔드 등을 누락하지 않되 조사 전에 정규 대분류로 고정하지 않기 위한 컨테이너 렌즈입니다."
      },
      "lifecycle": {
        "created_at": "2026-07-26",
        "last_reviewed_at": "2026-07-27",
        "review_due_at": "2026-10-27",
        "superseded_by": null
      }
    },
    {
      "id": "data-analytics-ml",
      "node_type": "domain",
      "status": "research_lens",
      "title_ko": "데이터·분석·ML",
      "title_en": "Data, analytics and machine learning",
      "definition": "데이터 수집·모델링·파이프라인·분석·품질·거버넌스와 ML을 조사하는 잠정 렌즈입니다.",
      "includes": [
        "데이터 엔지니어링, 분석 엔지니어링, 데이터 품질·거버넌스, 통계와 ML"
      ],
      "excludes": [
        "애플리케이션 DB 사용법 전체와 AI 에이전트 응용 전체"
      ],
      "parent_ids": [],
      "aliases": [
        "data engineering and analytics",
        "data and ML"
      ],
      "related_ids": [
        "ai-systems-agents",
        "software-product-engineering",
        "platform-quality-operations",
        "security-legal-governance"
      ],
      "external_mappings": [
        {
          "framework_id": "sfia-9",
          "mapping_type": "coverage_reference",
          "target": "Big data and data science skills view",
          "rationale": "데이터 전문 기술과 책임 수준의 누락을 점검하는 기준으로 사용합니다.",
          "status": "proposed"
        },
        {
          "framework_id": "dama-dmbok2r",
          "mapping_type": "coverage_reference",
          "target": "Data governance, architecture, modelling, storage, operations, integration, quality and security knowledge areas",
          "rationale": "데이터 관리의 안정된 지식영역과 경계를 점검하되 데이터 분석·ML 전체와 동일시하지 않습니다.",
          "status": "proposed"
        }
      ],
      "provenance": {
        "basis": "user_governance",
        "source_refs": [
          "docs/governance/learning-governance.md",
          "docs/research/phase2-capability-survey-runbook.md"
        ],
        "rationale": "데이터 엔지니어링·분석·ML의 경계를 조사 결과로 분리하기 전 누락을 막는 렌즈입니다."
      },
      "lifecycle": {
        "created_at": "2026-07-26",
        "last_reviewed_at": "2026-07-27",
        "review_due_at": "2026-10-27",
        "superseded_by": null
      }
    },
    {
      "id": "integration-automation",
      "node_type": "domain",
      "status": "research_lens",
      "title_ko": "통합·업무자동화",
      "title_en": "Integration and workflow automation",
      "definition": "API, MCP, SaaS, 결정적 자동화와 워크플로우 오케스트레이션을 조사하는 렌즈입니다.",
      "includes": [
        "API 통합, MCP, SaaS, 결정적 자동화, 워크플로우 오케스트레이션"
      ],
      "excludes": [
        "개별 애플리케이션 구현 전체와 조직변화 프로그램"
      ],
      "parent_ids": [],
      "aliases": [
        "workflow automation"
      ],
      "related_ids": [
        "ai-systems-agents",
        "software-product-engineering",
        "platform-quality-operations"
      ],
      "external_mappings": [
        {
          "framework_id": "sfia-9",
          "mapping_type": "boundary_reference",
          "target": "Systems integration, automation and digital transformation skills",
          "rationale": "전문 통합 역량과 책임 수준을 비교하되 SaaS별 사용법을 외부 분류로 대체하지 않습니다.",
          "status": "proposed"
        }
      ],
      "provenance": {
        "basis": "user_governance",
        "source_refs": [
          "docs/governance/learning-governance.md",
          "docs/research/phase2-capability-survey-runbook.md"
        ],
        "rationale": "비개발자 SaaS 자동화와 개발자 통합 구현을 함께 발견한 뒤 목적지 경계를 판정하기 위한 렌즈입니다."
      },
      "lifecycle": {
        "created_at": "2026-07-26",
        "last_reviewed_at": "2026-07-27",
        "review_due_at": "2026-10-27",
        "superseded_by": null
      }
    },
    {
      "id": "human-ai-experience",
      "node_type": "domain",
      "status": "research_lens",